CD_MUNICIPIO,NM_MUNICIPIO,NR_ZONA,NR_LOCAL_VOTACAO,NM_LOCAL,ENDERECO,LATITUDE,LONGITUDE
88013,PORTO ALEGRE,158,1660,BENTO GONCALVES - ESC. EST. DE ENSINO FUNDAMENTAL,"RUA JORGE FURTADO, 47 - VILA NOVA SANTA ROSA",,
88013,PORTO ALEGRE,160,1660,ESCOLA ESTADUAL VIOLETA MAGALHAES,"ESTRADA VILA MARIA, 415",-30.1106741,-51.2317678
88013,PORTO ALEGRE,1,1678,SALAO PAROQUIAL DA IGREJA  NOSSA SENHORA DA POMPEIA,"RUA BARROS CASSAL, 220",-30.027446,-51.2168896
88013,PORTO ALEGRE,113,1678,GEMA ANGELINA BELIA - ESCOLA ESTADUAL,"AV. ANTONIO DE CARVALHO, 495",-30.0613321,-51.1474113
88013,PORTO ALEGRE,114,1678,CENTRO DE COMUNIDADE SOCIOEDUCATIVA - CSE - FASE,AVENIDA JACUI S/N,-30.0801464,-51.2358745
88013,PORTO ALEGRE,158,1678,PADRE LEO - ESC. EST. DE ENS. FUNDAMENTAL,"RUA NOSSA SENHORA DE FATIMA, 195",-30.014499,-51.0965
88013,PORTO ALEGRE,2,1678,COLEGIO ESTADUAL JULIO DE CASTILHOS,"AV. PIRATINI, 76",-30.0441928,-51.212464
88013,PORTO ALEGRE,1,1686,ESCOLA ESTADUAL INACIO MONTANHA,"AV. JOAO PESSOA, 2125",-30.0484198,-51.2112417
88013,PORTO ALEGRE,111,1686,SENAI - CONSTRUÇÃO CIVIL,"RUA JAIME VIGNOLI, N. 693",,
88013,PORTO ALEGRE,113,1686,EDGAR LUIZ SCHNEIDER - ESCOLA ESTADUAL,"AV. ELIAS CIRNE LIMA, 100 - ESQ. AV. BENTO GONCALVES",,
88013,PORTO ALEGRE,158,1686,MIN. POTY MEDEIROS - ESC. EST. DE ENS. FUNDAMENTAL,"RUA VICENTE CELESTINO, 120 - PARQUE DOS MAIAS",-30.0079248,-51.0956069
88013,PORTO ALEGRE,161,1686,CLUBE DO PROFESSOR GAÚCHO,"AV. GUAÍBA, 12060",-30.144188,-51.2230055
88013,PORTO ALEGRE,2,1686,ESCOLA ESTADUAL LUCIANA DE ABREU,"RUA JACINTO OSORIO, 60",-30.040933,-51.2119928
88013,PORTO ALEGRE,1,1694,ESCOLA SÃO FRANCISCO - MENINO DEUS,"PRACA MENINO DEUS, 77",-30.0613661,-51.2233341
88013,PORTO ALEGRE,111,1694,VOTO EM TRÂNSITO - AEROPORTO SALGADO FILHO,"SEVERO DULLIUS, 90010",-29.9876983,-51.1800378
88013,PORTO ALEGRE,113,1694,ALDO LOCATELLI - ESCOLA ESTADUAL,"RUA THOMAZ FRANCISCO DE JESUS, S/N - VILA BRASILIA",-30.0500104,-51.1463645
88013,PORTO ALEGRE,114,1694,PENITENCIÁRIA FEMININO MADRE PELLETIER,"AVENIDA TERESOPOLIS, 2727",-30.0771117,-51.2093856
88013,PORTO ALEGRE,158,1694,GOVERNADOR ILDO MENEGHETTI - ESC. MUNICIPAL DE ENS. FUNDAMENTAL,"RUA JAYME CYRINO MACHADO DE OLIVEIRA, 250",-29.9928438,-51.105576
88013,PORTO ALEGRE,2,1694,CENTRO MUNICIPAL DE EDUCAÇÃO TRABALHADORES - PAULO FREIRE,"RUA SANTA TERESINHA, 572",-30.0393236,-51.2103566
88013,PORTO ALEGRE,1,1708,ESCOLA ESTADUAL EUCLIDES DA CUNHA,"RUA BARAO DO CERRO LARGO, 385",-30.0629081,-51.2276167
88013,PORTO ALEGRE,113,1708,JOSE MARIANO BECK - ESCOLA MUNICIPAL,"AV. JOAQUIM PORTO VILLANOVA, 135 - VILA PINTO",,
88013,PORTO ALEGRE,114,1708,CENTRO DE ATENDIMENTO SOCIOEDUCATIVO PADRE CACIQUE - FASE,"AV. PADRE CACIQUE, 1372",-30.0717164,-51.2373612
88013,PORTO ALEGRE,160,1708,IGREJA SAO MATEUS - GINASIO DE ESPORTES,"RUA SARGENTO NICOLAU DIAS DE FARIAS, 568",-30.1097775,-51.2558294
88013,PORTO ALEGRE,161,1708,EEEF CLOTILDE CACHAPUZ MEDEIROS,"RUA ARACHANES, 242",-30.1464055,-51.220862
88013,PORTO ALEGRE,2,1708,COLEGIO VICENTINO SANTA CECILIA,"RUA FELIPE DE OLIVEIRA, 448",-30.0426245,-51.1970855
88013,PORTO ALEGRE,113,1716,SEDE SOCIAL - CARRIS,"RUA FREI ANTÔNIO DE CAXIAS, 300",-30.0599004,-51.1643564
88013,PORTO ALEGRE,160,1716,SINDICAIXA - ASSOCIAÇÃO DOS SERVIDORES DA CEE/RS,"RUA MANOEL LEAO, 90",-30.1310684,-51.2396815
88013,PORTO ALEGRE,161,1716,EEEF CUSTÓDIO DE MELLO,"RUA ARGEMIRO OGANDO CORRÊA, 220",-30.1643191,-51.2279706
88013,PORTO ALEGRE,2,1716,ESCOLA ESTADUAL CANDIDO JOSE DE GODOI,"AV. FRANCA, 400",,
88013,PORTO ALEGRE,1,1724,ESCOLA ESTADUAL MANÉ GARRINCHA,"AV. ÉRICO VERÍSSIMO, 1255",-30.0568034,-51.2187455
88013,PORTO ALEGRE,113,1724,GINASIO - PARQUE ARARIGBOIA,"RUA SAICÃ, 06",-30.0467339,-51.1812994
88013,PORTO ALEGRE,158,1724,JULIO BRUNELLI - ESC. EST. DE ENS. FUNDAMENTAL,"RUA FERNANDO CAMARANO, 220 - COHAB RUBEM BERTA",-30.019123,-51.1049687
88013,PORTO ALEGRE,2,1724,UNIFIN FACULDADE SÃO FRANCISCO DE ASSIS,"AV. SERTORIO, 253",-29.9992975,-51.2031609
88013,PORTO ALEGRE,113,1732,PROF. LEA ROSA CECCHINI BRUM - ESCOLA ESTADUAL,"RUA JOSÉ ALBANO WOLKMER, 347 (ESQ RUA MARTA COSTA FRANZEN)",,
88013,PORTO ALEGRE,114,1732,"CEARÁ, ESC EST ENS MED","AV. ARNALDO BOHRER, 98",-30.083062,-51.2031339
88013,PORTO ALEGRE,160,1732,SOCIEDADE EDUCACIONAL LEONARDO DA VINCI - BETA,"AV. ICARAI, 1879",-30.0948444,-51.2456762
88013,PORTO ALEGRE,161,1732,EEEF PROF. LANGENDONCK,"RUA JACUNDÁ, 365",-30.1561454,-51.2219303
88013,PORTO ALEGRE,2,1732,ESCOLA NORMAL 1 DE MAIO,"AV. PRESIDENTE FRANKLIN ROOSEVELT, 149",-30.0010013,-51.2010429
88013,PORTO ALEGRE,158,1740,PROF. AURORA PEIXOTO DE AZEVEDO - ESC. EST. DE ENS. FUNDAMENTAL,"RUA PEDRO DOS SANTOS SÁ, 50 - VILA NOVA BRASILIA",-29.9875798,-51.1363897
88013,PORTO ALEGRE,160,1740,E. E. 1.G. MONTE LÍBANO,"RUA LEMÚRIA, 10",-30.1304272,-51.226101
88013,PORTO ALEGRE,161,1740,EEF MATHIAS DE ALBUQUERQUE,"AV. JUCA BATISTA, 3450",-30.1545829,-51.1992684
88013,PORTO ALEGRE,2,1740,ESCOLA ESTADUAL BRASÍLIA,"RUA DONA MARGARIDA, 1199",-30.0485098,-51.1460016
88013,PORTO ALEGRE,158,1759,CHICO MENDES - ESC. MUNICIPAL DE ENS. FUNDAMENTAL,"RUA GENTIL AMANCIO CLEMENTE, S/N - CHÁCARA DA FUMAÇA",-30.0325013,-51.1125515
88013,PORTO ALEGRE,160,1759,E. E. 1.G. INC. DR.TANCREDO NEVES,"RUA VER. ROBERTO LANDELL DE MOURA, 448",,
88013,PORTO ALEGRE,2,1759,ESCOLA ESTADUAL BENJAMIM CONSTANT,,,
88013,PORTO ALEGRE,1,1767,ESCOLA TECNICA ESTADUAL PAROBÉ,"AVENIDA LOUREIRO DA SILVA, 945",-30.0378057,-51.2313194
88013,PORTO ALEGRE,158,1767,CENTRO DE ENSINO MEDIO PASTOR DOHMS - UNIDADE ZONA NORTE,"AV. IRENE RUPERTI, 25",-30.0141044,-51.1090308
88013,PORTO ALEGRE,160,1767,E. E. 1.G. JARDIM VILA NOVA,"RUA FERNANDO PESSOA, 380",-30.1265779,-51.2089801
88013,PORTO ALEGRE,161,1767,EMEF SENADOR ALBERTO PASQUALINI,"RUA TENENTE ARISOLY FAGUNDES, 250 (RESTINGA NOVA)",-30.1531225,-51.1434296
88013,PORTO ALEGRE,2,1767,COLÉGIO JOÃO PAULO I,"RUA SÃO FRANCISCO DA CALIFÓRNIA, 90",-30.1249675,-51.239027
88013,PORTO ALEGRE,158,1775,CESMAR - CENTRO SOCIAL MARISTA,"ESTRADA ANTONIO SEVERINO,1493",-30.0256804,-51.0965239
88013,PORTO ALEGRE,160,1775,E. E. PAULINA MORESCO,"RUA TOMÉ ANTONIO DE SOUZA,160",-30.1336799,-51.1979505
88013,PORTO ALEGRE,161,1775,EMEF DOLORES ALCARAZ CALDAS,"RUA CARLOS NIEDERAUER HOFMEISTER, 85 (RESTINGA NOVA)",-30.1512056,-51.1374502
88013,PORTO ALEGRE,2,1775,ESCOLA ESTADUAL DALTRO FILHO,"AV. AMÉRICA, 145",-30.0191119,-51.1961416
88013,PORTO ALEGRE,160,1783,E. M. 1.G. LEOCÁDIA FELIZARDO PRESTES,"RUA ROMEU VASCONCELOS ROSA, 10",,
88013,PORTO ALEGRE,161,1783,EEEM JOSÉ DO PATROCINIO,"RUA BELIZE, 261 (RESTINGA VELHA)",-30.1579013,-51.1403577
88013,PORTO ALEGRE,160,1791,E. E. 1.G. PARAÍBA,"R ADÃO PINHEIRO DA SILVA, 490",-30.1381778,-51.216003
88013,PORTO ALEGRE,161,1791,EEEM RAUL PILLA,"RUA ENG. OSCAR DE OLIVEIRA RAMOS, 660 (RESTINGA NOVA)",-30.1482331,-51.1453348
88013,PORTO ALEGRE,2,1791,SALÃO PAROQUIAL IGREJA SÃO SEBASTIÃO,"AV. CAÇAPAVA, 251",-30.0424857,-51.1814695
88013,PORTO ALEGRE,160,1805,E. E. DE 1. E 2. GRAUS ODILA GAY DA FONSECA,"AV. OSVALDO GONCALVES CRUZ, 444",,
88013,PORTO ALEGRE,161,1805,EEEF EVARISTA FLORES DA CUNHA,"PÇA. INÁCIO ANTÔNIO DA SILVA, S/N",-30.2117688,-51.183617
88013,PORTO ALEGRE,2,1805,INSS - UNIDADE REABILITACAO PROFISSIONAL,"AV. BENTO GONCALVES, 867",-30.0621916,-51.1762687
88013,PORTO ALEGRE,160,1813,E. M. VILA MONTECRISTO,"BECO CARLOS SUPERTI, 84",-30.1250538,-51.2171704
88013,PORTO ALEGRE,161,1813,CE DOUTOR GLICÉRIO ALVES,"RUA EUSTÁQUIO INÁCIO DA SILVEIRA, 300",,
88013,PORTO ALEGRE,2,1813,ESCOLA ESTADUAL GABRIELA MISTRAL,"RUA CARLOS PESSOA DE BRUM, 150",-30.0573295,-51.2063851
88013,PORTO ALEGRE,161,1821,EEF MADRE RAFFO,"RUA DOUTOR CARLOS FLORES, 53",-30.2101115,-51.1830703
88013,PORTO ALEGRE,2,1821,ESCOLA ESTADUAL APELES PORTO ALEGRE,"RUA SAO MANOEL, 1981",-30.0511684,-51.2006596
88013,PORTO ALEGRE,161,1830,EEEM OSCAR COELHO DE SOUZA,"ESTR. DO VAREJÃO, 372",-30.2200417,-51.0970042
88013,PORTO ALEGRE,2,1830,ESCOLA ESTADUAL ENS FUNDAMENTAL MEDIANEIRA,"RUA GENERAL GOMES CARNEIRO, 45",-30.0695052,-51.211059
88013,PORTO ALEGRE,161,1848,CE ENGENHEIRO ILDO MENEGHETTI,"RUA EUGÊNIO RODRIGUES, 4919 (RESTINGA NOVA)",-30.1542702,-51.1475488
88013,PORTO ALEGRE,2,1848,SALAO PAROQUIAL IGREJA CORAÇÃO DE JESUS,"RUA CORONEL MANOEL PY, 82",-30.0156137,-51.1917366
88013,PORTO ALEGRE,2,1856,SENAI VISCONDE DE MAUÁ,"RUA COMENDADOR TAVARES, 436-582",-30.0000094,-51.2009791
88013,PORTO ALEGRE,161,1864,EEEF DR. JOSÉ LOUREIRO DA SILVA,"ESTR. RETIRO DA PONTA GROSSA, 3541",-30.1853389,-51.2093795
88013,PORTO ALEGRE,2,1864,CONSELHO REGIONAL DE QUÍMICA,"AV. ITAQUI, 45",-30.047353,-51.2257698
88013,PORTO ALEGRE,161,1872,EMEF LIDOVINO FANTON,"RUA MANOEL FARIA ROSA PRIMO, 940 (RESTINGA VELHA)",-30.1617922,-51.1435307
88013,PORTO ALEGRE,2,1872,IMED PORTO ALEGRE,"RUA DONA LAURA, 1020",-30.0294375,-51.1949176
88013,PORTO ALEGRE,161,1899,ESPORTE CLUBE LAJEADO,"AV. EDGAR PIRES DE CASTRO, 9316",-30.1583275,-51.1898287
88013,PORTO ALEGRE,161,1902,EMEF PROF. ANÍSIO TEIXEIRA,"RUA FRANCISCO MATTOS TERRES, 40",-30.1594639,-51.2002636
88013,PORTO ALEGRE,161,1961,EMEF VEREADOR CARLOS PESSOA DE BRUM,"RUA ABOLIÇÃO, 1 (RESTINGA VELHA)",-30.1570522,-51.1356349
88013,PORTO ALEGRE,161,1988,EMEF CHAPÉU DO SOL,"RUA GOMERCINDO DE OLIVEIRA, S/N - LOT. CHAPÉU DO SOL",-30.1769301,-51.1738935
88013,PORTO ALEGRE,159,1996,ESC. MUN. DE 1 GRAU AFONSO GUERREIRO LIMA,"RUA GUAIBA, 203 - PARADA 11",,
88013,PORTO ALEGRE,161,1996,EEEF SOLIMÕES,"ESTR. DAS QUIRINAS, PRÓX. PDA. 27",,
88013,PORTO ALEGRE,159,2011,ESC. MUN. DE 1 GRAU SAO PEDRO,"BECO DA TAQUARA, S/N - VILA SAO PEDRO - PARADA 13",,
88013,PORTO ALEGRE,161,2011,EEEF HENRIQUE FARJAT,"AV. EDGAR PIRES DE CASTRO, 3050",-30.1584499,-51.1609991
88013,PORTO ALEGRE,159,2020,ESC. MUN. DE 1 GRAU INC. SAINT HILAIRE,"RUA GERVAZIO BRAGA PINHEIRO, 427 - VILA PANORAMA - PARADA 18",,
88013,PORTO ALEGRE,161,2020,EMEF MÁRIO QUINTANA,"RUA C, 1 (VILA CASTELO - 5 UNIDADE)",-30.1540666,-51.1323499
88013,PORTO ALEGRE,159,2038,ESC. EST. DE ENSINO FUNDAMENTAL MARIA CRISTINA CHIKA,"ESTR. JOAO DE OLIVEIRA REMIAO, 6505 - PARADA 16",,
88013,PORTO ALEGRE,161,2038,EEEF ARAGUAIA,"ESTR. GEDEON LEITE, 780",-30.1538022,-51.1828678
88013,PORTO ALEGRE,159,2046,ESC. EST. DR. OSCAR TOLLENS,"RUA VIDAL DE NEGREIROS, 432",-30.0655123,-51.1675732
88013,PORTO ALEGRE,161,2046,EEEF GENERAL NETO,"AV. EDGAR PIRES DE CASTRO, 10521",-30.2046795,-51.1160971
88013,PORTO ALEGRE,161,2054,EEEF MARGARIDA COELHO DE SOUZA,"AV. DO LAMI, 4742",-30.2119848,-51.1320293
88013,PORTO ALEGRE,161,2062,EEEF PEDRO AMERICO,"ESTR. CHAPÉU DO SOL, 1680",-30.1781373,-51.1686522
88013,PORTO ALEGRE,159,2070,COLEGIO MARISTA CHAMPAGNAT - SECAO ESPECIAL,"AV. BENTO GONCALVES, 4314",-30.0600883,-51.173132
88013,PORTO ALEGRE,161,2070,EMEF NOSSA SENHORA DO CARMO,"RUA BISPO MARINO PRUDÊNCIO MOREIRA, 95 (5A UNIDADE)",-30.1456156,-51.1278126
88013,PORTO ALEGRE,159,2089,ESC. EST. DE ENSINO FUNDAMENTAL MADRE MARIA SELIMA,"RUA TENENTE ARY TARRAGO PARTENON, 130",-30.0717314,-51.1790332
88013,PORTO ALEGRE,161,2089,EMEF RINCÃO,"RUA LUIZ OTAVIO, 391",-30.1194126,-51.1612346
88013,PORTO ALEGRE,159,2097,ESC. MUN. ENSINO FUND. PROFA. JUDITH MACEDO DE ARAUJO,"RUA SAUL CONSTANTINO, 100 - MORRO DA CRUZ",,
88013,PORTO ALEGRE,161,2097,SOCIEDADE HÍPICA PORTO ALEGRENSE,"AV. NOSSA SENHORA DE GUADALUPE, 249-339",,
88013,PORTO ALEGRE,161,2100,ESCOLA NEO-HUMANISTA DE ENSINO FUNDAMENTAL ANANDA MARGA,,,
88013,PORTO ALEGRE,161,2119,EMEF CAMPOS DO CRISTAL,"BECO DO IMPÉRIO, 75 - VILA NOVA",-30.119446,-51.2011203
88013,PORTO ALEGRE,161,2127,EMEF MORADAS DA HIPICA,"RUA GERALDO TOLLENS LINCK, S/N",-30.1589674,-51.1711582
88013,PORTO ALEGRE,161,2135,EEEF MARIA ALTINA DE ARAUJO,"ESTRADA COSTA GAMA, 3501",-30.1371138,-51.1733872
88013,PORTO ALEGRE,161,2143,ESCOLA DE EDUCAÇÃO INFANTIL ARCO IRIS II,"RUA TOBAGO, 1258 (RESTINGA VELHA)",,
88013,PORTO ALEGRE,159,2151,ESCOLA ESTADUAL RAFAELA REMIAO,"ESTRADA JOÃO DE OLIVEIRA REMIÃO, 2689 - PAR. 06",-30.0978121,-51.1265734
88013,PORTO ALEGRE,161,2151,CESI - ZONA SUL,"AV. JUCA BATISTA, 4770",-30.1600929,-51.1871803
88013,PORTO ALEGRE,161,2160,PARÓQUIA N. S. APARECIDA - C. SOCIAL PE. PEDRO LEONARDI,"ESTR. CHÁCARA DO BANCO, 71 (RESTINGA VELHA)",,
88013,PORTO ALEGRE,159,2178,FACULDADE DE DIREITO-PUCRS (PRÉDIO 11),"AV. IPIRANGA, 6681 - PRÉDIO 11",,
88013,PORTO ALEGRE,161,2178,SÃO FRANCISCO PROJETO SOCIAL,"AV. PRINCIPAL DA PONTA GROSSA, 1701",-30.1813317,-51.187829
88013,PORTO ALEGRE,159,2186,PAULO DA GAMA - ESCOLA ESTADUAL,"RUA SILVADO, 555",-30.0695301,-51.1854187
88013,PORTO ALEGRE,161,2186,E. E. M. VINÍCIUS DE MORAIS,,,
88013,PORTO ALEGRE,161,2194,EEIEF FAG NHIN,"ESTR. JOÃO DE OLIVEIRA REMIÃO, 9105 - PDA. 25",,
88013,PORTO ALEGRE,159,2208,EMEF DEPUTADO MARCÍRIO GOULART LOUREIRO,RUA SAIBREIRA S/N,-30.0765025,-51.1736064
88013,PORTO ALEGRE,161,2208,EMEEF TRISTÃO SUCUPIRA VIANNA,"AV. ECONOMISTA NILO WULFF, 955 (RESTINGA NOVA)",-30.1498682,-51.1458575
88013,PORTO ALEGRE,159,2216,PRESÍDIO CENTRAL DE PORTO ALEGRE - PAVILHÕES A/E - ELEIÇÕES 2014,,,
88013,PORTO ALEGRE,161,2216,EEEF NOSSA SENHORA DA CONCEIÇÃO,"AV. JOÃO ANTÔNIO DA SILVEIRA, 5071",-30.1453509,-51.1136936
88013,PORTO ALEGRE,161,2224,EEEF HEITOR VILLA-LOBOS,"ESTR. DA EXTREMA, 2943",-30.2141619,-51.0507185
88013,PORTO ALEGRE,159,2232,PRESÍDIO CENTRAL DE PORTO ALEGRE - PAVILHÃO B - ELEIÇÕES 2014,,,
88013,PORTO ALEGRE,159,2240,PRESÍDIO CENTRAL DE PORTO ALEGRE - PAVILHÕES C/D - ELEIÇÕES 2014,,,
88013,PORTO ALEGRE,159,2259,PRESÍDIO CENTRAL DE PORTO ALEGRE - PAVILHÃO F - ELEIÇÕES 2014,,,
88013,PORTO ALEGRE,159,2267,PRESÍDIO CENTRAL DE PORTO ALEGRE - PAVILHÕES G/H/I/J - ELEIÇÕES 2014,,,
88013,PORTO ALEGRE,159,2321,ESC. EST. DE ENSINO MÉDIO AGRÔNOMO PEDRO PEREIRA,"AV. BENTO GONÇALVES, 8426",-30.0747727,-51.1344917
88013,PORTO ALEGRE,159,2348,CADEIA PÚBLICA DE PORTO ALEGRE - PAVILHÃO B,"AV. ROCIO, 1100",-30.0727334,-51.1828407
88013,PORTO ALEGRE,159,2364,CADEIA PÚBLICA DE PORTO ALEGRE - PAVILHÃO F,"AV. ROCIO, 1100",-30.0727334,-51.1828407
88013,PORTO ALEGRE,159,2372,"CADEIA PÚBLICA DE PORTO ALEGRE - PAVILHÕES G, H, I, J","AV. ROCIO, 1100",-30.0727334,-51.1828407
88013,PORTO ALEGRE,159,2402,CADEIA PÚBLICA DE PORTO ALEGRE,"AV. ROCIO, 1100",-30.0727334,-51.1828407
88153,RIO GRANDE,163,1015,UNIVERSIDADE DO RIO GRANDE,"CAMPUS CARREIROS, S/N",-29.7208061,-53.7147066
88153,RIO GRANDE,163,1031,ESCOLA ESTADUAL MASCARANHAS DE MORAES,"RUA DOMINGOS DE ALMEIDA, 659",-32.0469547,-52.1150481
88153,RIO GRANDE,37,1031,ESCOLA ESTADUAL DE ENSINO MÉDIO DR. AUGUSTO DUPRAT,"RUA DOM PEDRO II, 260",-30.0079154,-51.190178
88153,RIO GRANDE,163,1040,ESCOLA ESTADUAL TREZE DE MAIO,"RUA DOM BOSCO, 901",-29.7562646,-57.0893617
88153,RIO GRANDE,37,1040,ESCOLA ESTADUAL DE ENSINO FUNDAMENTAL BARÃO DE CERRO LARGO,"AV. COMENDADOR VASCO VIEIRA DA FONSECA, 723",-30.0629081,-51.2276167
88153,RIO GRANDE,163,1058,ESCOLA ESTADUAL ADELAIDE DE ALVIM,"RUA OLAVO BILAC, 260",-32.0567198,-52.1456826
88153,RIO GRANDE,37,1058,ESCOLA ESTADUAL DE ENSINO MÉDIO BIBIANO DE ALMEIDA,"RUA GENERAL CANABARRO, 321",-32.0337419,-52.1024738
88153,RIO GRANDE,163,1066,ESCOLA EDUCANDÁRIO CORAÇÃO DE MARIA,"AV. PRESIDENTE VARGAS, S/N",-32.0510687,-52.1193369
88153,RIO GRANDE,163,1074,ESCOLA ESTADUAL ROBERTO BASTOS TELLECHEA,"AVENIDA DOS GRANDES LAGOS, 300",-32.1003995,-52.1805983
88153,RIO GRANDE,37,1074,ESCOLA MUNICIPAL DE ENSINO FUNDAMENTAL HELENA SMALL,"RUA BARÃO DE COTEGIPE, 155",-32.0367269,-52.1005011
88153,RIO GRANDE,163,1090,ESCOLA MUNICIPAL CIPRIANO PORTO ALGRE,"RUA COMENDADOR HENRIQUE PANCADA, 1027",-32.0420163,-52.1289241
88153,RIO GRANDE,163,1104,ESCOLA ESTADUAL EMILIO LUIZ MALLET,RUA AMAZONAS ESQ PERU S/N,,
88153,RIO GRANDE,37,1104,INSTITUTO ESTADUAL DE EDUCAÇÃO JUVENAL MILLER,"RUA ANDRADE NEVES, S/N",-32.0369,-52.0925566
88153,RIO GRANDE,163,1112,ESCOLA MUNICIPAL FRANCA PINTO,"RUA MINAS GERAIS, S/N",-32.0456079,-52.1207982
88153,RIO GRANDE,37,1112,COLÉGIO ESTADUAL LEMOS JUNIOR,"RUA DR NASCIMENTO, 373",-32.0364543,-52.1019287
88153,RIO GRANDE,163,1120,SALÃO COMUNITÁRIO NOSSA SENHORA DE FÁTIMA,ILHA DO LEONIDIO,,
88153,RIO GRANDE,163,1139,ESCOLA MUNICIPAL CORACAO DE MARIA,ILHA DOS MARINHEIROS,-32.0048287,-52.150032
88153,RIO GRANDE,37,1139,COLÉGIO BOM JESUS JOANA DARC,"RUA GENERAL CAMARA, 291",-32.03562,-52.0908047
88153,RIO GRANDE,163,1147,ESCOLA ESTADUAL DR.PEDRO BERTONI,DOMINGOS PETROLINE,-31.9970028,-52.3035933
88153,RIO GRANDE,37,1147,COLÉGIO MARISTA SÃO FRANCISCO,"RUA DR. NASCIMENTO, 577",-32.03562,-52.1020413
88153,RIO GRANDE,163,1155,ESPORTE CLUBE ESPERANCA SALAO DE FESTAS,3 DISTRITO,-30.0303272,-52.9291779
88153,RIO GRANDE,163,1163,SALÃO PAROQUIAL - POVO NOVO,DISTRITO DE POVO NOVO,,
88153,RIO GRANDE,37,1163,IFRS - INSTITUTO FEDERAL RS,"RUA ENGENHEIRO ALFREDO HUCK, 475",-32.0404687,-52.0879066
88153,RIO GRANDE,163,1171,CRISTOVAO PEREIRA DE ABREU,ILHA DA TOROTAMA,-31.916664,-52.152569
88153,RIO GRANDE,37,1171,ESCOLA ESTADUAL DE ENSINO FUNDAMENTAL AGNELLA DO NASCIMENTO,"RUA MARECHAL DEODORO, 249",-32.0310831,-52.1102786
88153,RIO GRANDE,37,1180,ESCOLA MUNICIPAL DE ENSINO FUNDAMENTAL CLEMENTE PINTO,"RUA DOM PEDRO I, 444",-31.7645934,-52.3706721
88153,RIO GRANDE,163,1198,ESCOLA AURORA FERREIRA CADAVAL,VILA DO TAIM,,
88153,RIO GRANDE,37,1198,COLÉGIO SALESIANO LEÃO XIII,"RUA MARECHAL DEODORO, 628",-32.0310831,-52.1102786
88153,RIO GRANDE,163,1201,ESCOLA LILIA NEVES,"RUA TRAJANO LOPES, S/N",-32.0740412,-52.2589287
88153,RIO GRANDE,163,1210,ESCOLA MUNICIPAL BENTO GONÇALVES,VILA DA QUINTA,-31.3146953,-52.2329635
88153,RIO GRANDE,37,1228,ESCOLA ESTADUAL DE ENSINO FUNDAMENTAL NOSSA SENHORA MEDIANEIRA,"AVENIDA BUARQUE DE MACEDO, 259",-31.7661444,-52.3349308
88153,RIO GRANDE,163,1236,SALAO PAROQUIAL,QUINTA,-28.4083805,-54.9611473
88153,RIO GRANDE,37,1236,ESCOLA ESTADUAL DE ENSINO FUNDAMENTAL NOSSA SENHORA MEDIANEIRA,"AVENIDA DOMINGOS DE ALMEIDA, S/N",-31.7661444,-52.3349308
88153,RIO GRANDE,163,1244,ESCOLA MUNICIPAL ALTAMIR DE LACERDA,RUA RAUL PILLA 2099,-29.1590105,-51.1526815
88153,RIO GRANDE,163,1252,ESCOLA MUNICIPAL DE ENS. FUND. RUI POESTER PEIXOTO,"RUA QUINTINO BOCAIUVA, 324",-32.0551688,-52.1519634
88153,RIO GRANDE,163,1260,ESCOLA ESTADUAL ALMIRANTE TAMANDARE,"AV. DOS ARQUIPELAGOS, 111",-32.0100908,-52.0398173
88153,RIO GRANDE,37,1260,ESCOLA ESTADUAL DE ENSINO FUNDAMENTAL ALCIDES BARCELOS,,-28.731201,-52.841286
88153,RIO GRANDE,163,1279,ESCOLA MUNICIPAL SANTANA,"RUA COLOMBIA, 586",-30.069464,-51.1552765
88153,RIO GRANDE,37,1279,ESCOLA MUNICIPAL DE ENSINO FUNDAMENTAL VIRIATO CORREA,"RUA ALMIRANTE BARROSO, 433",-32.0350179,-52.0877165
88153,RIO GRANDE,163,1287,ESCOLA ESTADUAL GETULIO VARGAS,"RUA DOM BOSCO, S/N",-28.1303607,-53.5276806
88153,RIO GRANDE,163,1295,ESCOLA MUNICIPAL DOM PEDRO II,CORREDOR DO BOSQUE,-29.6618744,-52.2531757
88153,RIO GRANDE,37,1295,ESCOLA ESTADUAL DE ENSINO MÉDIO BRIGADEIRO JOSÉ DA SILVA PAES,"RUA ISNARD POESTER PEIXOTO, S/N",,
88153,RIO GRANDE,163,1309,ESCOLA MUNICIPAL ASSIS BRASIL,"AV. BELO BRUM, S/N",-29.5573646,-55.125957
88153,RIO GRANDE,163,1317,APOLINARIO PORTO ALEGRE,ILHA DA MARAMBAIA,-30.0397885,-51.2235579
88153,RIO GRANDE,163,1333,ESCOLA ARGEMIRO DIAS DE LIMA,VILA DA PALMA,-30.6887093,-54.1919224
88153,RIO GRANDE,37,1333,ESCOLA ESTADUAL DE ENSINO FUNDAMENTAL GUARDA MARINHA GREENHALGH,"RUA CRISTOVÃO JACQUES, S/N",-32.0428827,-52.0976004
88153,RIO GRANDE,163,1350,ESCOLA MUNICIPAL MATE AMARGO,"AV. ITALIA, 1352",-32.076887,-52.1531896
88153,RIO GRANDE,163,1376,ESCOLA ESTADUAL CARLOS LOREA PINTO,COHAB IV,-29.153106,-51.5030377
88153,RIO GRANDE,37,1376,ESCOLA ESTADUAL DE ENSINO FUNDAMENTAL CORONEL JUVÊNCIO LEMOS,"AVENIDA DOM PEDRO II, S/N",-28.0595448,-52.0077759
88153,RIO GRANDE,163,1384,CIEP,"RUA EDUARDO ARAUJO, 881",-28.1518685,-54.727708
88153,RIO GRANDE,37,1384,ESCOLA ESTADUAL DE ENSINO FUNDAMENTAL ERNESTO PEDROSO,"RUA DR. ANTÔNIO AUGUSTO BORGES MEDEIROS, S/N",,
88153,RIO GRANDE,163,1392,PENITENCIÁRIA ESTADUAL DE RIO GRANDE - PERG,BR 392 KM 15,-31.7934386,-52.3430145
88153,RIO GRANDE,37,1392,ESCOLA ESTADUAL DE ENSINO MÉDIO SILVA GAMA,"RUA ITAQUI, 400",-32.1778506,-52.1675101
88153,RIO GRANDE,37,1406,ESCOLA ESTADUAL DE ENSINO FUNDAMENTAL SALDANHA DA GAMA,"AVENIDA PRINCIPAL, S/N - 4 SECÇÃO DA BARRA",,
88153,RIO GRANDE,37,1414,ESCOLA MUNICIPAL DE ENSINO FUNDAMENTAL PROFESSOR MANOEL MARTINS MANO,"RUA ENGENHEIRO JOÃO KRAMER DE LIMA, S/N",-32.1075929,-52.1771216
88153,RIO GRANDE,37,1422,ESCOLA MUNICIPAL DE ENSINO FUNDAMENTAL PEDRO CARLOS PEIXOTO PRIMO,"AVENIDA CASSINO, 1316 - QUERENCIA",-32.2097775,-52.1851292
88153,RIO GRANDE,37,1430,ESCOLA MUNICIPAL DE ENSINO FUNDAMENTAL HUMBERTO DE CAMPOS,,-28.731201,-52.841286
88153,RIO GRANDE,37,1449,ESCOLA MUNICIPAL DE ENSINO FUNDAMENTAL ANA NERI,"RUA DONA ANA PERNIGOTTI, S/N",,
88153,RIO GRANDE,37,1457,ESCOLA MUNICIPAL DE ENSINO FUNDAMENTAL PROFESSORA WANDA ROCHA MARTINS,"RUA FERNANDO OSÓRIO, 201",-32.1786071,-52.1615516
88153,RIO GRANDE,37,1465,ESCOLA MUNICIPAL DE ENSINO FUNDAMENTAL DOLORES GARCIA,"RUA DARCY CUNHA MATTOS, 387 - PQ GUANABARA",,
88153,RIO GRANDE,37,1473,ESCOLA MUNICIPAL DE ENSINO FUNDAMENTAL RAMIZ GALVÃO,"RUA MANOEL JOSÉ, N. 26 - VILA MANGUEIRA",-32.0625981,-52.086985
88153,RIO GRANDE,37,1481,ESCOLA MUNICIPAL DE ENSINO FUNDAMENTAL ELIÉZER DE CARVALHO RIOS,"RUA ERECHIM, N. 15",-32.177008,-52.1468919
88153,RIO GRANDE,37,1490,ESCOLA MUNICIPAL DE ENSINO INFANTIL VOVÓ ZOQUINHA,"RUA JÚLIO DE CASTILHOS, S/N",-32.1813196,-52.1695021
88498,SANTA VITÓRIA DO PALMAR,43,1015,ESC. SAO CARLOS,"RUA CONRADO ALVES GUIMARAES, 132 - FONE 32631566",,
88498,SANTA VITÓRIA DO PALMAR,43,1023,ESC. EST. DE EDUC. BASICA MANOEL VICENTE DO AMARAL,"PRACA GETULIO VARGAS, 1467",,
88498,SANTA VITÓRIA DO PALMAR,43,1066,COLEGIO ESTADUAL SANTA VITORIA DO PALMAR,"RUA BARAO DO RIO BRANCO, 1186 - FONE 32631785",-33.5232965,-53.3606483
88498,SANTA VITÓRIA DO PALMAR,43,1082,CLUBE COMERCIAL,RUA BARAO DO RIO BRANCO 307 CENTRO,-33.5205039,-53.3697047
88498,SANTA VITÓRIA DO PALMAR,43,1090,ESC. EST. DE ENS. FUND. PROF. ABILIO AZAMBUJA,"RUA DR. JOÃO DE OLIVEIRA, 1697",,
88498,SANTA VITÓRIA DO PALMAR,43,1104,ESC.MUN. ENS. FUND. MARECHAL CASTELO BRANCO,RUA GENERAL OSORIO 2347,-33.5118875,-53.3604681
88498,SANTA VITÓRIA DO PALMAR,43,1120,ASSOCIACAO ATLETICA BANCO DO BRASIL,RUA DOS ANDRADAS 1778                  CENTRO,,
88498,SANTA VITÓRIA DO PALMAR,43,1155,GRUPO ESCOLAR WANDELINA NUNES,RUA CORONEL DE DEUS 1120,-33.5322546,-53.3790837
88498,SANTA VITÓRIA DO PALMAR,43,1180,ESC. MUN. ENS. FUND. ORIETE ISIDORA GARCIA,RUA CAMPOS NEUTRAIS 3244,,
88498,SANTA VITÓRIA DO PALMAR,43,1198,SALAO DA RAMADA,GRANJA DO SALSO - CANOA MIRIM,,
88498,SANTA VITÓRIA DO PALMAR,43,1228,ESC. MUN. ENS. FUND. PROF. OSCAR MACHADO,BR 471 KM 613,,
88498,SANTA VITÓRIA DO PALMAR,43,1244,ESC. MUN. ENS. FUND. BERNARDO ARRIADA,BR 471 KM 148,-33.5281172,-53.3429928
88498,SANTA VITÓRIA DO PALMAR,43,1287,ESC. MUN. ENS. FUND.JOSE BERNARDINO DE SOUZA CASTRO,BARRA DO CHUI,-33.7366253,-53.3723237
88498,SANTA VITÓRIA DO PALMAR,43,1295,ESC. MUN. ENS. FUND. COL. ALVARO AUGUSTO DE CARVALHO,PRAIA DO HERMENEGILDO - FONE 32642112,,
88498,SANTA VITÓRIA DO PALMAR,43,1317,ESC. MUN. ENS. FUND. GETULIO VARGAS,"AV. GETULIO VARGAS , 06",-33.5217983,-53.3735774
88498,SANTA VITÓRIA DO PALMAR,43,1325,ESC. MUN. ENS. FUND.FRANCISCO OSVALDO ANSELMI,"RUA FLORENCIO DO AMARAL, S/N - FONE 32638048",,
88498,SANTA VITÓRIA DO PALMAR,43,1341,ESC. MUN. ENS. FUND. OSMARINO DE OLIVEIRA TERRA,"RUA TREOLINO DA COSTA SOARES, N 40",,
88498,SANTA VITÓRIA DO PALMAR,43,1350,ESCOLA ARESMI TAVARES,RUA GAL. CANABARRO 20-A - FONE 32633196,,
88498,SANTA VITÓRIA DO PALMAR,43,1368,(APAE) CRAEE,RUA DOM DIOGO DE SOUZA,-33.5159319,-53.3726328
88498,SANTA VITÓRIA DO PALMAR,43,1376,EMEI DONATOS,"RUA SAO MIGUEL, N. 2235",-33.5158525,-53.3582537
88498,SANTA VITÓRIA DO PALMAR,43,1384,EMEF PROFESSORA MARIA RAMIS,RUA PALMAR S/N,-33.51339,-53.3551757
88498,SANTA VITÓRIA DO PALMAR,43,1406,EMEF BRASILINO PATELLA,CANOA MIRIM,-33.0564613,-53.3203814
88730,SÃO JOSÉ DO NORTE,130,1015,ESCOLA ESTADUAL DE ENSINO FUNDAMENTAL  MARQUES DE SOUZA,"RUA MARECHAL FLORIANO, N 162",-32.0121386,-52.0390586
88730,SÃO JOSÉ DO NORTE,130,1023,POSTO DE SAUDE ESTADUAL,,-32.0046322,-52.0432373
88730,SÃO JOSÉ DO NORTE,130,1031,CÍRCULO OPERÁRIO NORTENSE,RUA GENERAL OSÓRIO N 101,-32.0122461,-52.0375907
88730,SÃO JOSÉ DO NORTE,130,1040,SEDE DO SPORT CLUB BARRENSE,POVOACAO DA BARRA,,
88730,SÃO JOSÉ DO NORTE,130,1058,SALAO DA IRMANDADE NOSSA SENHORA DA BOA VIAGEM,POVOACAO DA BARRA,,
88730,SÃO JOSÉ DO NORTE,130,1066,SALÃO PAROQUIAL DA  IRMANDADE MENINO DEUS DA CAPELA,RETOVADO,-31.9021114,-51.9438926
88730,SÃO JOSÉ DO NORTE,130,1090,SALÃO DA IGREJA  EVANGÉLICA  ASSEMBLÉIA DE DEUS,ESTRADA VELHA - SÃO CAETANO,,
88730,SÃO JOSÉ DO NORTE,130,1104,SALÃO PAROQUIAL DE SÃO CAETANO,ESTRADA VELHA - SAO CAETANO,,
88730,SÃO JOSÉ DO NORTE,130,1112,SALÃO NOSSA SENHORA DA CONCEIÇÃO,VILA DO ESTREITO,-31.8253829,-51.7427494
88730,SÃO JOSÉ DO NORTE,130,1120,ESCOLA MUNICIPAL PADRE EUGENIO TICK,VILA DO ESTREITO,-31.8253829,-51.7427494
88730,SÃO JOSÉ DO NORTE,130,1147,ESCOLA MUNICIPAL CENTRO DE DEMONSTRAÇÕES,CAPÃO DO MEIO,,
88730,SÃO JOSÉ DO NORTE,130,1155,ESCOLA ESTADUAL DE ENSINO FUNDAMENTAL CAPITÃO LUIZ DA SILVA FERREIRA,BUJURU,-31.6321612,-51.4178699
88730,SÃO JOSÉ DO NORTE,130,1163,CENTRO EDUCACIONAL DE BUJURU,,-32.0046322,-52.0432373
88730,SÃO JOSÉ DO NORTE,130,1180,ESCOLA MUNICIPAL DE ENSINO FUNDAMENTAL CORONEL ANTÔNIO SOARES DE PAIVA,"RUA ARAGÃO BOZANO, N. 632",-32.0096538,-52.0415536
88730,SÃO JOSÉ DO NORTE,130,1198,CLUBE RECREATIVO E CULTURAL  SÓCRATES,RUA RAMIRO BARCELOS S/N,-32.0053204,-52.043066
88730,SÃO JOSÉ DO NORTE,130,1201,INSTITUTO ESTADUAL DE EDUCAÇÃO  SAO JOSÉ,"RUA RAMIRO BARCELOS, 874",-32.0100908,-52.0398173
88730,SÃO JOSÉ DO NORTE,130,1210,ESCOLA MUNICIPAL DOM FREDERICO DE DONET,VILA DO BARRANCO,,
88730,SÃO JOSÉ DO NORTE,130,1228,ESCOLA ESTADUAL SILVERIO DA COSTA NOVO,5 SECAO DA BARRA,,
