CD_MUNICIPIO,NM_MUNICIPIO,NR_ZONA,NR_LOCAL_VOTACAO,NM_LOCAL,ENDERECO,LATITUDE,LONGITUDE
85871,CANGUÇU,14,2003,ASSOCIAÇÃO DE DESENVOLVIMENTO COMUNITÁRIO DO PASSO DA CANOA,RINCÃO DOS CRAVOS,-31.5509153,-52.9527585
85871,CANGUÇU,14,2046,ESCOLA DR. JAIME DE FARIA,CANGUÇU VELHO,-31.3694424,-52.6330671
85871,CANGUÇU,14,2054,SALÃO DA IGREJA EVANGÉLICA DO ADVENTO,REMANSO,-31.3913775,-52.889065
85871,CANGUÇU,14,2062,UNIDADE BÁSICA DE SAÚDE DO PASSO DO LOURENÇO,PASSO DO LOURENÇO,-31.5569203,-52.8199439
85898,CANOAS,134,1015,BARAO DO AMAZONAS - ESC. EST. ENSINO FUNDAMENTAL,"RUA VENANCIO AIRES, 3120 ",-29.9343072,-51.1754463
85898,CANOAS,170,1015,CRISTO REDENTOR-COLÉGIO ULBRA,,-29.9214771,-51.1888616
85898,CANOAS,171,1015,CRISTO REDENTOR-COLÉGIO ULBRA,,-29.9214771,-51.1888616
85898,CANOAS,66,1015,CENTRO UNIVERSITÁRIO LA SALLE,"VICTOR BARRETO, 2288",-29.9171444,-51.1811684
85898,CANOAS,134,1023,CSSGAPA - CLUBE DOS SUBOFICIAIS E SARGENTOS,"RUA TOBIAS BARRETO, 990",-29.9352615,-51.1604741
85898,CANOAS,170,1023,MARECHAL RONDON-COLÉGIO ESTADUAL,,-29.9214771,-51.1888616
85898,CANOAS,171,1023,MARECHAL RONDON-COLÉGIO ESTADUAL,,-29.9214771,-51.1888616
85898,CANOAS,66,1023,ASSOCIAÇÃO CULTURAL E BENEFICENTE GAÚCHO (BOLÃO GAÚCHO),ARACA 129,-29.9247473,-51.1843578
85898,CANOAS,170,1031,ESC MUN ENS FUND CEARA,,-29.9214771,-51.1888616
85898,CANOAS,171,1031,ÉRICO VERÍSSIMO-E.E.E. MED,,-29.9214771,-51.1888616
85898,CANOAS,66,1031,SALÃO PAROQUIAL SÃO LUÍS GONZAGA,"CÔNEGO JOSÉ LEÃO HARTMANN, 82",-29.9183944,-51.1835217
85898,CANOAS,134,1040,COLEGIO ESPIRITO SANTO - SOC. ENSINO BENEFICIENCIA PROVINCIA DO SUL,"RUA TAMOIO, 3393",-29.9306849,-51.1678311
85898,CANOAS,170,1040,ESC MUN ENS FUND THIAGO WURTH,,-29.9214771,-51.1888616
85898,CANOAS,171,1040,CASTELO BRANCO-E.M. DE 1 G.I.,,-29.9214771,-51.1888616
85898,CANOAS,66,1040,COLÉGIO MARIA AUXILIADORA,"GUILHERME SCHELL, 5888",-29.9173719,-51.1837454
85898,CANOAS,134,1058,CARLOS CHAGAS - INSTITUTO ESTADUAL DE EDUCACAO DR.,"RUA SANTA CRUZ, S/N",-29.946627,-51.1602746
85898,CANOAS,170,1058,CARLOS CHAGAS - INSTITUTO ESTADUAL DE EDUCACAO DR.,,-29.9214771,-51.1888616
85898,CANOAS,171,1058,EDGAR FONTOURA-E.M. E FUND. PREF.,,-29.9214771,-51.1888616
85898,CANOAS,66,1058,ESCOLA DE ENS. FUND. CANOAS,"GUILHERME MORSCH, 141",-29.9218312,-51.1826714
85898,CANOAS,170,1066,COLEGIO ULBRA SAO JOAO,,-29.9214771,-51.1888616
85898,CANOAS,66,1066,ESC. EST. DE ENS. MÉDIO ANDRÉ LEÃO PUENTE,"VICTOR KESSLER, 291",-29.9153915,-51.1856278
85898,CANOAS,134,1074,CENTRO DE PASTORAL LA SALLE,RUA LAJEADO 1300,-29.9541644,-51.1717136
85898,CANOAS,170,1074,ESC EST ENS MEDIO TEREZA FRANCESCUTTI,,-29.9214771,-51.1888616
85898,CANOAS,66,1074,ESCOLA ESTADUAL DE ENSINO MÉDIO GUILHERME DE ALMEIDA,"RUA CLOVIS BEVILAQUA, 963",-29.9128949,-51.2086935
85898,CANOAS,170,1082,ESC EST ENS MEDIO SAO FRANCISCO DE ASSIS,,-29.9214771,-51.1888616
85898,CANOAS,171,1082,SETE DE SETEMBRO -E.M. DE 1 G.I.,,-29.9214771,-51.1888616
85898,CANOAS,66,1082,SALÃO PAROQUIAL NOSSA SENHORA DE FÁTIMA,"OLIVEIRA VIANA, 350",-29.9417936,-51.1817738
85898,CANOAS,134,1090,CONCORDIA - COLEGIO LUTERANO,"RUA CAPISTRANO DE ABREU, 229",-29.9501585,-51.1742416
85898,CANOAS,170,1090,ESCOLA ESTADUAL DE ENS. MÉDIO GUARANI,,-29.9214771,-51.1888616
85898,CANOAS,171,1090,MIGUEL LAMPERT- COLÉGIO ESTADUAL,,-29.9214771,-51.1888616
85898,CANOAS,66,1090,ESCOLA ESTADUAL DE ENS. MÉDIO GUARANI,"RUA CAIRU, 2260",-29.9425458,-51.1845753
85898,CANOAS,134,1104,JOSE GOMES DE VASCONCELOS JARDIM - ESCOLA ESTADUAL DE ENS. MEDIO,RUA SANTOS FERREIRA 2985,,
85898,CANOAS,170,1104,ESC LUTERANA COMUNITARIA ENS FUND SAO MATEUS,,-29.9214771,-51.1888616
85898,CANOAS,171,1104,GERMANO WITROCK-E.E. DE ENS. FUND.PROF.,,-29.9214771,-51.1888616
85898,CANOAS,170,1112,SALAO PAROQUIAL SAO PIO X,,-29.9214771,-51.1888616
85898,CANOAS,171,1112,VASCO DA GAMA - E.E. DE ENS.FUND.,,-29.9214771,-51.1888616
85898,CANOAS,66,1112,E.E.E.F. PROFESSORA CLOTILDE BATISTA,"RUA CORONEL CAMISÃO, 415",-29.9138911,-51.1958849
85898,CANOAS,134,1120,GUANABARA - ESC. EST. DE ENSINO FUNDAMENTAL,"RUA ALEGRETE, 1359",-29.9546295,-51.1627582
85898,CANOAS,170,1120,ESC MUN ENS FUND PROF ODETTE YOLANDA O FREITAS,,-29.9214771,-51.1888616
85898,CANOAS,171,1120,VICENTE FREIRE - E.E. DE ENS.FUND. CEL.,,-29.9214771,-51.1888616
85898,CANOAS,66,1120,ESC. LUTERANA DE 1 GRAU DR. MARTINHO LUTERO,"RUA CORONEL VICENTE, N 1340",-29.918469,-51.1930092
85898,CANOAS,134,1139,JASMELINO JARDIM - ESC. EST. DE ENS. FUNDAMENTAL,"TRAVESSA INDIGENA, 1",,
85898,CANOAS,170,1139,ESC MUN ENS FUND MIN RUBEM CARLOS LUDWIG,,-29.9214771,-51.1888616
85898,CANOAS,171,1139,SALÃO PAROQUIAL SÃO CRISTÓVÃO,,-29.9214771,-51.1888616
85898,CANOAS,66,1139,ESC. MUN. DE ENS. FUND. ARTHUR PEREIRA DE VARGAS,"RUA DOS CEDROS, 23",-29.9171342,-51.2067685
85898,CANOAS,134,1147,LA SALLE NITERÓI - SOCIEDADE PORVIR CIENTIFICO,RUA TAMOIO 821,-29.9539144,-51.1686347
85898,CANOAS,171,1147,PADRE JAEGER - E.E. DE ENS. FUND.,,-29.9214771,-51.1888616
85898,CANOAS,170,1155,ESC MUN ENS FUND DAVID CANABARRO,,-29.9214771,-51.1888616
85898,CANOAS,171,1155,PAZ- UNIDADE DE ENSINO,,-29.9214771,-51.1888616
85898,CANOAS,134,1163,DUQUE DE CAXIAS - ESC. MUN. DE ENSINO FUNDAMENTAL,"RUA MONTE CASTELO, 975",-29.9285422,-51.165445
85898,CANOAS,170,1163,ESC MUN ENS FUND MAX ADOLFO ODERICH,,-29.9214771,-51.1888616
85898,CANOAS,171,1163,SÃO MARCOS-ESCOLA ULBRA,,-29.9214771,-51.1888616
85898,CANOAS,170,1171,ESC EST ENS FUND CRISTOVAO COLOMBO,,-29.9214771,-51.1888616
85898,CANOAS,171,1171,GUAJUVIRAS - E.M. E. FUND. (COLÉGIO UM),,-29.9214771,-51.1888616
85898,CANOAS,134,1180,FARROUPILHA - ESCOLA MUNICIPAL ENSINO FUNDAMENTAL,RUA ALBERTO BINS 160,-29.9367797,-51.1688308
85898,CANOAS,170,1180,ESC MUN ENS FUND JOAO PAULO I,,-29.9214771,-51.1888616
85898,CANOAS,171,1180,CARLOS DRUMOND DE ANDRADE - E.M. DE 1 G.,,-29.9214771,-51.1888616
85898,CANOAS,171,1198,MARGOT T.N. GIACOMAZZI-E.E. DE ENS. MED. PROF.,,-29.9214771,-51.1888616
85898,CANOAS,134,1201,AMJI - ASSOCIAÇÃO DOS MORADORES DO JARDIM IDEAL,"RUA NAZARÉ, 617",-29.9295154,-51.15621
85898,CANOAS,171,1201,GENERAL NETO - E.M.E FUND.,,-29.9214771,-51.1888616
85898,CANOAS,134,1210,PERNAMBUCO - ESCOLA MUNICIPAL DE ENSINO FUNDAMENTAL,"RUA CONCORDIA, 1740",-29.950207,-51.1586369
85898,CANOAS,171,1210,JUSSARA MARIA POLIDORO-COLÉGIO ESTADUAL. PROF.,,-29.9214771,-51.1888616
85898,CANOAS,171,1228,NANCY FERREIRA PANSERA - E. M. DE ENS. FUND. PROF.,,-29.9214771,-51.1888616
85898,CANOAS,134,1236,SANTOS DUMONT - ESCOLA MUNICIPAL DE ENSINO FUNDAMENTAL,RUA ARTHUR BERNARDES 654,,
85898,CANOAS,171,1244,PLANALTO CANOENSE - E. E. DE ENS.FUND.,,-29.9214771,-51.1888616
85898,CANOAS,134,1252,THEODORO BOGEN - ESCOLA MUNICIPAL DE ENSINO FUNDAMENTAL,"RUA 11 DE JUNHO,1001",-29.9412189,-51.1656905
85898,CANOAS,171,1252,ERNA WÜRTH - E. M. DE ENS. FUND. (CAIC),,-29.9214771,-51.1888616
85898,CANOAS,66,1252,ESCOLA MUN. DE ENS. FUND. ASSIS BRASIL,"ROBERTO FRANCISCO BEHERENS, 520",,
85898,CANOAS,134,1260,SAO JOSE - ESCOLA DE ENSINO FUNDAMENTAL,RUA IRAI 459,-29.9643248,-51.1722836
85898,CANOAS,171,1260,WALTER PERACCHI DE BARCELLOS - E. M. DE ENS. FUND. GOV.,,-29.9214771,-51.1888616
85898,CANOAS,66,1260,ESCOLA MUN. DE ENS. FUND. RIO GRANDE DO SUL,"WENCESLAU BRAS, 35",,
85898,CANOAS,171,1279,O ACADÊMICO - CENTRO EDUCACIONAL CANOENSE,,-29.9214771,-51.1888616
85898,CANOAS,66,1279,COLÉGIO DA IMACULADA,ANA NERY 1285,-29.9607314,-51.1898022
85898,CANOAS,171,1287,CÔNEGO JOSÉ LEÃO HARTMANN -E.E. DE ENS. MED.,,-29.9214771,-51.1888616
85898,CANOAS,66,1287,ESC. EST. DE ENS. FUND. ANTÔNIO FRANCISCO LISBOA,PISTOIA 1255,-29.9540043,-51.1865217
85898,CANOAS,66,1295,ESC. EST. DE ENS. FUND. ÁLVARO MOREYRA,"HERMES DA FONSECA, S/N",-29.965727,-51.1888726
85898,CANOAS,134,1309,COLÉGIO RUI BARBOSA,"RUA JULIO DE CASTILHOS, 207",-29.955979,-51.1738537
85898,CANOAS,66,1309,ESC. EST. DE ENS. FUND. BARTOLOMEU DE GUSMÃO,PRIMAVERA 515,-29.9615377,-51.1815839
85898,CANOAS,134,1317,BARAO DO AMAZONAS - ESC. EST. ENSINO FUNDAMENTAL,"RUA OSVALDO CRUZ, 329",-29.940102,-51.1732271
85898,CANOAS,66,1317,ESC. EST. DE ENS. MÉDIO VISCONDE DO RIO BRANCO (POLIVALENTE),"RUA PISTOIA, 664",-29.9606325,-51.1848185
85898,CANOAS,134,1325,JOAO XXIII - ESC. EST. ENSINO MÉDIO,RUA SANTOS DUMONT 1721,-29.9461011,-51.1588126
85898,CANOAS,66,1325,ESC. MUN. DE ENS. FUND. CORONEL FRANCISCO PINTO BANDEIRA,"RUA NELSON PAIM TERRA, 1435",,
85898,CANOAS,134,1333,PROTASIO DIOGO DE JESUS - ESCOLA ESTADUAL DE ENS. FUNDAMENTAL,RUA DA FIGUEIRA 315,-29.9319079,-51.1739789
85898,CANOAS,66,1333,ESCOLA MUN. DE ENS. FUND. GENERAL OSÓRIO,"RUA NELSON PAIM TERRA, 925",,
85898,CANOAS,66,1341,ESC. MUN. DE ENS. FUND. DR. NELSON PAIM TERRA,"RUA PRIMAVERA,1676",-29.9651381,-51.1933903
85898,CANOAS,134,1368,IGREJA LUTERANA - COMUNIDADE EVANGELICA DE CANOAS,RUA MONTE CASTELO 470,-29.9215721,-51.161142
85898,CANOAS,134,1376,IRMÃO PEDRO - E.M. DE ENS. FUND.,"RUA OLAVO FERNANDES, 91",-29.9237734,-51.1403829
85898,CANOAS,134,1384,RONDÔNIA - E.M. DE ENS. FUND.,"RUA A. J. RENNER, 211",-29.9254997,-51.1466173
85898,CANOAS,134,1392,ILDO MENEGHETTI - E. M. DE ENS. FUND. ENG.,"RUA IMBÉ, 25",-29.916573,-51.1442849
85898,CANOAS,134,1406,"INSTITUTO FEDERAL DE EDUCAÇÃO, CIÊNCIA E TECNOLOGIA DO RS - IFRS","RUA DRA. MARIA ZÉLIA CARNEIRO DE FIGUEIREDO, 870",,
85898,CANOAS,134,1414,NANCY FERREIRA PANSERA - E. M. E. F. PROF.,"SETOR 6, AREA VERDE 13, S/N",,
85898,CANOAS,66,1414,ESCOLA MUNICIPAL DE ENSINO FUNDAMENTAL GONCALVES DIAS,"RUA ENG. KINDLER, 1450 - VILA CERNE",-29.9133363,-51.2164437
85898,CANOAS,134,1422,COLÉGIO ROMANO SÃO JOSÉ,"RUA LICÍNIO CARDOSO, 121",-29.8818769,-51.1761566
85898,CANOAS,66,1422,ESC. MUN.  DE EDUCAÇÃO INFANTIL PROFESSORA MARILENE DA SILVA MACHADO,"RUA KANSAS, NÚMERO 400, LOTEAMENTO CENTRAL PARK",,
85898,CANOAS,134,1430,SETE DE SETEMBRO -E.M.E.F.,"ESTRADA DO NAZÁRIO, 1205",-29.9047642,-51.1297268
85898,CANOAS,66,1430,CENTRO UNIVERSITÁRIO LA SALLE,"AV VICTOR BARRETO, 2288",-29.9171444,-51.1811684
85898,CANOAS,134,1449,VASCO DA GAMA - E.E. ENS.FUND.,"RUA BOLÍVIA, 580",-29.8858363,-51.1734819
85898,CANOAS,66,1449,ESC MUN ENS FUND DAVID CANABARRO,"RUA FLORIANOPOLIS, 3893",-29.9060089,-51.2217883
85898,CANOAS,134,1457,ÉRICO VERÍSSIMO-E.E.ENS.MED.,"RUA BOQUEIRÃO, 1320",-29.8850747,-51.1375786
85898,CANOAS,66,1457,ESC MUN ENS FUND THIAGO WURTH,"AV. RIO GRANDE DO SUL,  4240",-29.9010717,-51.228036
85898,CANOAS,134,1465,COLÉGIO ROMANO SÃO PAULO,"RUA JACOB LONGONI, 10",-29.9247139,-51.1305309
85898,CANOAS,66,1465,ESC EST ENS MEDIO BENTO GONCALVES,"AV. RIO GRANDE DO SUL, 1055",-29.9021831,-51.190595
85898,CANOAS,134,1473,CÔNEGO JOSÉ LEÃO HARTMANN -E.E. ENS. MED.,"AV. 17 DE ABRIL, S/N - SETOR 4",,
85898,CANOAS,66,1473,ESC MUN ENS FUND PROF ODETTE YOLANDA O FREITAS,"RUA ERECHIM, 200",-29.9016752,-51.2333384
85898,CANOAS,134,1481,GUAJUVIRAS - E.M.E.F.,"RUA ANDRÉ LUIZ DOS ANJOS CONCEIÇÃO, 577",-29.9020928,-51.1349144
85898,CANOAS,66,1481,ESC MUN ENS FUND RIO DE JANEIRO,"RUA VEREADOR ANTONIO FERREIRA ALVES, 900",-29.9086493,-51.1828499
85898,CANOAS,134,1490,JUSSARA MARIA POLIDORO-COL. ESTADUAL,"AV. DEZESSETE DE ABRIL, S/N",-29.9012833,-51.1391418
85898,CANOAS,66,1490,ESC EST ENS FUND DR VICTOR HUGO LUDWIG,"AV. RIO GRANDE DO SUL, 2292",-29.9020035,-51.2037198
85898,CANOAS,134,1503,WALTER PERACCHI DE BARCELOS - E. M.E.F. GOV.,"RUA ALBERTO RODRIGUES DE OLIVEIRA, 125",-29.9238317,-51.1304842
85898,CANOAS,66,1503,ESC MUN ENS FUND JOAO PAULO I,"RUA SAO PEDRO PESCADOR,  525",-29.9093766,-51.2073348
85898,CANOAS,134,1511,MARGOT TEREZINHA NOAL GIACOMAZZI-E.E.ENS. MED. PROF.,"RUA ARROIO TEIXEIRA, S/N",-29.9090146,-51.1479583
85898,CANOAS,66,1511,ESC MUN ENS FUND MIN RUBEM CARLOS LUDWIG,"RUA SARANDI, 160",-29.9009607,-51.2226898
85898,CANOAS,134,1520,CRISTO REDENTOR-UNIDADE ENSINO,"RUA INCONFIDÊNCIA, 1231",-29.9263542,-51.1802615
85898,CANOAS,66,1520,ESC MUN SURDOS VITORIA,"AV. CACAPAVA,  400",-29.9025095,-51.1971234
85898,CANOAS,134,1538,GENERAL NETO - E.M.E.F.,"RUA JOSÉ DANILO MENEZES, 150",-29.9152203,-51.119422
85898,CANOAS,66,1538,ESC EST ENS FUND CRISTOVAO COLOMBO,SENADOR SALGADO FILHO 250,-29.8875453,-51.1823802
85898,CANOAS,134,1546,MARECHAL RONDON-COL. ESTADUAL,"RUA SANTINI LONGONI, 147",-29.9191159,-51.175815
85898,CANOAS,66,1546,ESC LUTERANA COMUNITARIA ENS FUND SAO MATEUS,"RUA FLORIANOPOLIS , 5201",-29.9078313,-51.1839471
85898,CANOAS,134,1554,O ACADÊMICO - EDU.CO,"RUA INCONFIDENCIA, 762",-29.9263542,-51.1802615
85898,CANOAS,66,1554,ESC MUN ENS FUND CEARA,"RUA SAO PAULO, 465",-29.89836,-51.1823999
85898,CANOAS,134,1562,CARLOS DRUMMOND DE ANDRADE - E.M. E.F.,"RUA 6, 400 - SETOR 5",,
85898,CANOAS,66,1562,COLEGIO ULBRA SAO JOAO,"RUA CAMPINAS ,  660",-29.9049931,-51.1967223
85898,CANOAS,134,1570,ERNA WÜRTH - E. M.E.F.,"AV. 17 DE ABRIL, S/N",,
85898,CANOAS,66,1570,ESC EST ENS MEDIO SAO FRANCISCO DE ASSIS,"RUA CAMPINAS, 2020",-29.9051289,-51.2114157
85898,CANOAS,134,1589,PADRE JAEGER - E.E. ENS. FUND.,"RUA SEN. ALBERTO PASQUALINE, 100",,
85898,CANOAS,66,1589,ESC MUN ENS FUND MAX ADOLFO ODERICH,"RUA PROF. DONA SARA, 100",-29.9104547,-51.2273108
85898,CANOAS,134,1597,PLANALTO CANOENSE - E. E.ENS.FUND.,"RUA DR.SEZEFREDO AZAMBUJA VIEIRA, 61",-29.9191638,-51.1448864
85898,CANOAS,66,1597,SALAO PAROQUIAL SAO PIO X,"AV. RIO GRANDE DO SUL, 414",-29.9032321,-51.1824498
85898,CANOAS,134,1600,SALÃO PAROQUIAL SÃO CRISTÓVÃO,"RUA TUPI, 228",-29.8973884,-51.1657958
85898,CANOAS,66,1600,ESC EST ENS MEDIO TEREZA FRANCESCUTTI,"AV. RIO GRANDE DO SUL, 3430",-29.9016109,-51.2173413
85898,CANOAS,134,1619,VICENTE FREIRE - E.E. ENS.FUND. CEL.,"RUA TIETE, 276",-29.9004001,-51.1699978
85898,CANOAS,134,1627,CASTELO BRANCO-E.M.E.F.,"RUA TAPAJÓS, 275",-29.9027847,-51.1625254
85898,CANOAS,134,1635,GERMANO WITROCK-E.E.ENS. FUND.PROF.,"RUA ARAGUAIA, S/N",-29.9011804,-51.1688524
85898,CANOAS,134,1643,MIGUEL LAMPERT- COL. ESTADUAL,"RUA JOÃO LEIVAS DE CARVALHO, 461",-29.882808,-51.175418
85898,CANOAS,134,1651,EDGAR FONTOURA-E.M.E.F.PREF.,"RUA SÃO PEDRO, 555",-29.9184137,-51.1691768
85898,CANOAS,134,1678,"COMPLEXO PENITENCIÁRIO DE CANOAS - PECAN II, III E IV","ESTRADA DO NAZÁRIO, 3505",-29.9047642,-51.1297268
85898,CANOAS,134,1686,AUGUSTO SEVERO -ESCOLA EST. DE ENS. FUND.,"RUA ALEGRETE, 278",-29.9544285,-51.1728033
85898,CANOAS,134,1694,JACOB LONGONI - EMEF,"RUA PORTO SEGURO, 197",-29.9328288,-51.1582893
89737,CAPÃO DO LEÃO,164,1015,ESC. MUN. ALVARO BERCHON,PASSO DAS PEDRAS - 3 DISTRITO,,
89737,CAPÃO DO LEÃO,164,1023,ESC. MUN. PREF. ELBERTO MADRUGA,"AV. JUSCELINO K. DE OLIVEIRA, 2492",,
89737,CAPÃO DO LEÃO,164,1058,ESC. MUN. BARAO DE STO. ANGELO,"AV. TRES DE MAIO, 3100",-31.7625314,-52.40455
89737,CAPÃO DO LEÃO,164,1066,ESC. EST. PRES. CASTELO BRANCO,"RUA DR. EDUARDO OLINDO SICCA, 2515",,
89737,CAPÃO DO LEÃO,164,1082,ESC. EST. DR. DARIO DA SILVA TAVARES,"AV. NARCISO SILVA, 1957",-31.7664192,-52.5016265
89737,CAPÃO DO LEÃO,164,1155,ESC. MUN. PROF. MARGARIDA GASTAL,EMBRAPA/UFPEL,,
89737,CAPÃO DO LEÃO,164,1163,ARMAZEM TIO JULIO,FIGUEIRINHAS - 4 DISTRITO,,
89737,CAPÃO DO LEÃO,164,1171,ESC. MUN. COM. PARQUE FRAGATA,"RUA DIARI DA CUNHA QUINTANA, 473",-31.7565362,-52.4639068
89737,CAPÃO DO LEÃO,164,1201,COMUNIDADE SANTA RITA DE CASSIA,PAVAO - 2 DISTRITO,,
89737,CAPÃO DO LEÃO,164,1210,E.M.E.F . PROFESSORA DELFINA BORDALO DE PINHO,"BR 293, KM 37 - 3 DISTRITO",,
89737,CAPÃO DO LEÃO,164,1236,ESC. MUN. PROF. ELMAR DA SILVA COSTA,"PRACA DA IMPRENSA, 251",-31.7635632,-52.4237416
85944,CERRO GRANDE DO SUL,84,1325,ESC MUNICIPAL DE ENS FUND FORTALEZA,"RUA DR. JORGE ALFREDO HENNING, 855",-30.5968439,-51.7507675
85944,CERRO GRANDE DO SUL,84,1341,E. E. DE ENS. FUND. MARIA DE JESUS SCHUMMACHER,AVENIDA SETE DE SETEMBRO,-30.6356764,-51.727305
85944,CERRO GRANDE DO SUL,84,1350,E. E. DE ENS. MEDIO MEM DE SA,"RUA DR. HENRIQUE VILA NOVA, 30",,
85944,CERRO GRANDE DO SUL,84,1368,E. E. DE ENS. FUND. FRANCISCO JOSE PEREIRA,ESTRADA GARAMBEU,-30.6358874,-51.705331
85944,CERRO GRANDE DO SUL,84,1376,E. E. DE ENS. FUND. MANOELA ALVES PACHECO,ESTRADA PESSEGUEIROS,,
85944,CERRO GRANDE DO SUL,84,1384,UNIDADE DE SAÚDE ANTÔNIO MOSCARDINI NETTO,SAO JOSE,-28.161402,-54.7299898
85944,CERRO GRANDE DO SUL,84,1392,ESCOLA MUNICIPAL DE ENS. FUND. ANTONIO JOSE PEREIRA,ESTRADA DATA DOS TAVARES,,
85944,CERRO GRANDE DO SUL,84,1406,ESCOLA MUNICIPAL DE ENS. FUND. JOSE DE ALENCAR,ESTRADA CINCO ESTUFAS,,
85944,CERRO GRANDE DO SUL,84,1414,ESCOLA MUNICIPAL DE ENS. FUND. SANTA INES,ESTRADA CAMPO DOS TEIXEIRAS,,
85944,CERRO GRANDE DO SUL,84,1422,ESPORTE CLUBE TIRIRICA,TIRIRICA    ,-30.4759045,-51.7757146
85944,CERRO GRANDE DO SUL,84,1430,ESCOLA MUNICIPAL DE ENS. FUND. PADRE REUS,ESTRADA PICADA DA CRUZ,,
85944,CERRO GRANDE DO SUL,84,1449,SALÃO PAROQUIAL IGREJA SANTA BÁRBARA,ESTRADA CACHOEIRA DO IPE,,
85944,CERRO GRANDE DO SUL,84,1490,SALÃO PAROQUIAL IGREJA SÃO JOSÉ,ESTRADA SÃO JOSÉ,-28.1396682,-54.8157018
88269,CHUVISCA,12,1015,E E DE 1 GRAU INC HILÁRIO MARIANO USZACKI,CAPELA VELHA,,
88269,CHUVISCA,12,1023,SALAO PAROQUIAL DA CAPELA SAO PEDRO,,-30.7554935,-51.9786927
88269,CHUVISCA,12,1031,SALAO PAROQUIAL DO DIVINO ESPIRITO SANTO,,-30.7554935,-51.9786927
88269,CHUVISCA,12,1040,ESCOLA MUNICIPAL DE ENS. FUND. ARLINDO BONIFÁCIO PIRES,COSTA DO SUTIL,,
88269,CHUVISCA,12,1058,ESC. MUNIC. DE ENS. FUND. MARECHAL DEODORO,BOA VISTA  ,,
88269,CHUVISCA,12,1074,E E DE 1 GRAU PROF ALAÍDES SCHUMACHER PINHEIRO,CHUVISCA                               SÃO BRAZ 9 DISTRITO,,
88269,CHUVISCA,12,1082,SALÃO DA COMUNIDADE NOSSA SENHORA DE LURDES,GUARAXAIM DA SERRA                     SÃO BRÁS 9 DISTRITO,,
88269,CHUVISCA,12,1104,ESCOLA MUNICIPAL DE ENS. FUND. PROFESSOR WILSON LUIZ DA SILVA,,-30.7554935,-51.9786927
88269,CHUVISCA,12,1112,ESCOLA MUNICIPAL DE ENS. FUND. SANTA LUZIA,PICADA GRANDE  ,-30.7401154,-51.9743809
88269,CHUVISCA,12,1139,ESCOLA MUNICIPAL DE ENS. FUND. ALVINO NIQUEL,,-30.7554935,-51.9786927
88269,CHUVISCA,12,1147,ESCOLA MUNICIPAL DE ENS. FUND. GEORGE HASS,,-30.7554935,-51.9786927
85464,CRISTAL,12,1511,ESCOLA MUNICIPAL ENS. FUND. ANTONIO CURI,PASSO DA CANCELA,,
85464,CRISTAL,12,1686,UNIDADE BÁSICA DE SAÚDE DO CORDEIRO,CORDEIRO,-31.0137732,-51.9117061
85464,CRISTAL,12,1694,COLÉGIO ESTADUAL BENTO GONÇALVES DA SILVA,"RUA JOSÉ APARECIDO VIEIRA DE ALMEIDA, S/N   F 3678-1574",,
85464,CRISTAL,12,1708,SALAO PAROQUIAL DA IGREJA CATOLICA,CRISTAL                                VILA CRISTAL 7 DIST  ,,
85464,CRISTAL,12,1767,ESCOLA MUNICIPAL DE ENS. FUND. OTTO BECKER,BUTIA    ,-30.0782087,-51.2378462
85464,CRISTAL,12,2143,ESC. EST. ENS. FUND. DARCY PEIXOTO DA SILVEIRA - CIEP,RUA LAJEADO S/N,-31.0018823,-52.0485303
85464,CRISTAL,12,2151,UNIDADE BÁSICA DE SAÚDE,VILA FORMOSA,-30.0811163,-51.2314478
86274,DOM FELICIANO,12,1015,CTG,CENTRO,-30.0826822,-51.0272732
86274,DOM FELICIANO,12,1023,ESCOLA ESTADUAL DOM FELICIANO,RUA VENANCIO AIRES S/N                 CENTRO,-29.9380315,-50.9951157
86274,DOM FELICIANO,12,1031,GINÁSIO MUNICIPAL DE ESPORTES (ESCOLA CATULINO EM REFORMA),"RUA BORGES DE MEDEIROS, 279",-30.704466,-52.1087
86274,DOM FELICIANO,12,1040,ASSOCIAÇÃO RURAL DOS MORADORES DO CAPIVARI,CAPIVARI                               ZONA RURAL,,
86274,DOM FELICIANO,12,1058,SALÃO DA COMUNIDADE SÃO CASSEMIRO (ANTIGA ESCOLA SÃO VALENTIM),COLÔNIA NOVA,,
86274,DOM FELICIANO,12,1066,SALÃO DA COMUNIDADE SANTA CECÍLIA,ZONA RURAL,,
86274,DOM FELICIANO,12,1074,ESCOLA MUNICIPAL SAO JOAO BATISTA,LOCALIDADE GASPAR SIMOES ,,
86274,DOM FELICIANO,12,1082,ESCOLA MUNICIPAL N SRA  DA CONCEICAO,,,
86274,DOM FELICIANO,12,1090,ESCOLA MUNICIPAL SANTA TERESINHA,FAXINAL                                ZONA RURAL,,
86274,DOM FELICIANO,12,1104,ESCOLA MUNICIPAL NOSSA SENHORA DE FATIMA,CAVADEIRA,,
86274,DOM FELICIANO,12,1112,ESCOLA MUNICIPAL PADRE VIEIRA,PONTE DO SUTIL                        ZONA RURAL,,
86274,DOM FELICIANO,12,1120,ESCOLA MUNICIPAL CASTRO ALVES,REMANSO                                ZONA RURAL,,
86274,DOM FELICIANO,12,1139,ESCOLA MUNICIPAL PADRE CONSTANTINO,LINHA AMARAL FERRADOR                  ZONA RURAL  ,,
86274,DOM FELICIANO,12,1147,SALÃO COMUNIDADE SAGRADO CORAÇÃO DE JESUS,CAMINHO NOVO                           ZONA RURAL,,
86274,DOM FELICIANO,12,1155,CENTRO COMUNITARIO CRISTO RESSUSCITADO,CERRO DO CAPITAO                       ZONA RURAL  ,,
86274,DOM FELICIANO,12,1163,SOCIEDADE SANTO ADALBERTO,LINHA TIGRE                            ZONA RURAL  ,,
86290,DOM PEDRITO,18,1015,E. NOSSA SENHORA DO HORTO,"AV. RIO BRANCO, 1206",-30.9854627,-54.6701879
86290,DOM PEDRITO,18,1031,E. E. BERNARDINO ANGELO,"RUA 07 DE SETEMBRO, 1309",,
86290,DOM PEDRITO,18,1040,E. E. DE ENS. MEDIO NOSSA SENHORA DO PATROCINIO,"RUA JOSE BONIFACIO, 1332",-30.9822766,-54.6751502
86290,DOM PEDRITO,18,1058,E. E. E. F. CORONEL URBANO DA CHAGAS,"RUA MINISTRO DEMÉTRIO MERCIO XAVIER, 1359",-30.9813777,-54.667095
86290,DOM PEDRITO,18,1104,CLUBE COMERCIAL,"RUA BERNARDINO ANGELO, 915",-30.9822763,-54.6811976
86290,DOM PEDRITO,18,1112,E. M. R. E. F. PEDRO BERNARDO DOS SANTOS,CERRO DOS MELLO,,
86290,DOM PEDRITO,18,1120,RANCHO FARROUPILHA DR. ANTÔNIO CÂNDIDO DA SILVA NETO,AV. BORGES DE MEDEIROS - PRAÇA CENTRAL,,
86290,DOM PEDRITO,18,1139,E. E. E. F. SENADOR PASQUALINI,"RUA PROFESSOR PAMPLONA, 771",-30.9682859,-54.674035
86290,DOM PEDRITO,18,1147,E. M. SEPE TIARAJU,CAMPO SECO,-30.6553388,-54.7654956
86290,DOM PEDRITO,18,1155,E. M. ANNA RIET PINTO,BR 293,-30.9732689,-54.651582
86290,DOM PEDRITO,18,1171,E.M.E.F. ARGENY DE OLIVEIRA JARDIM,"DAVI CANABARRO, 100",-30.9720295,-54.6793453
86290,DOM PEDRITO,18,1198,SALÃO SÃO DOMINGOS,TRÊS VENDAS - 3 SUB DISTRITO,,
86290,DOM PEDRITO,18,1228,ESCOLA ESTADUAL NA SERRILHADA,,-30.9744014,-54.6613625
86290,DOM PEDRITO,18,1244,E. E. E. F. DULCE DA FONTE ABREU,"RUA 03 DE OUTUBRO, 23",,
86290,DOM PEDRITO,18,1252,ESCOLA MUNICIPAL SUCESSAO DO MORAES,UPACARAI,-31.0809227,-54.9390721
86290,DOM PEDRITO,18,1260,E. E. RIZOLETA DE QUADROS,TORQUATO SEVERO - 2 DISTRITO,,
86290,DOM PEDRITO,18,1295,ASSOCIACAO RURAL,"AV. RIO BRANCO, 896",-30.9847009,-54.6751598
86290,DOM PEDRITO,18,1309,E. E. E. F. PROFESSOR PAMPLONA,"SERAFIM DOS ANJOS FREIRE, 2270",,
86290,DOM PEDRITO,18,1317,E. E. E. F. ARTHUR VILLAMIL DE CASTRO,,-30.9744014,-54.6613625
86290,DOM PEDRITO,18,1325,E. M. E. F. PROF. BERNARDINO TATU,"RUA CONDE DE PORTO ALEGRE, 535",-30.9880018,-54.6754066
86290,DOM PEDRITO,18,1333,E. M. E. F. ALDA SEABRA,"RUA OSVALDO ARANHA, 2048",,
86290,DOM PEDRITO,18,1341,E. E. E. F.  ALZIRA BARCELLOS,"RUA SANTOS DUMONT, 1428",-30.992738,-54.6747116
86290,DOM PEDRITO,18,1350,E. E. E. F. HELOIZA LOUZADA,"RUA PROF. PAMPLONA, 424",-30.9682859,-54.674035
86290,DOM PEDRITO,18,1368,E. M. E. F. DR. JOSE TUDE DE GODOY,"RUA WALTER GOWERT, 2088",,
86290,DOM PEDRITO,18,1376,E. E. E. F. GETULIO DORNELES VARGAS - CIEP,"RUA PEDRO PAZ SOBRINHO, N. 1991",,
86290,DOM PEDRITO,18,1384,E. M. E. F. ALCIDES MAIA,"RUA MAJOR LEOPOLDINO DUTRA SOBRINHO, 727",-30.9673449,-54.6730171
86290,DOM PEDRITO,18,1392,E. M. E. F.  HERODIANO ARRUÉ,"RUA ANTENOR MADRUGA, 3251",,
86355,ENCRUZILHADA DO SUL,19,1015,ESCOLA ESTADUAL BORGES DE MEDEIROS,"RUA CONDE DE PORTO ALEGRE, 154",-30.5509528,-52.5135838
86355,ENCRUZILHADA DO SUL,19,1023,ESCOLA ESTADUAL CARLOS CORREA DA SILVEIRA - GINÁSIO,"RUA FELIPE NORONHA, 261",-30.5451947,-52.5205305
86355,ENCRUZILHADA DO SUL,19,1031,ESCOLA ESTADUAL GOMERCINDA DORNELES DA FONTOURA - NORMAL,"RUA DR. GASTÃO GONÇALVES LOPES, 107",,
86355,ENCRUZILHADA DO SUL,19,1040,ESCOLA MUNICIPAL ANJO DA GUARDA,"RUA TEN. CEL. AVIADOR JOSÉ ROBERTO SPALDING CORRÊA, 278",,
86355,ENCRUZILHADA DO SUL,19,1082,CENTRO COMUNITÁRIO - CERRO DA MARIA SANTA,CERRO DA MARIA SANTA,-30.6619008,-52.3626441
86355,ENCRUZILHADA DO SUL,19,1090,SALÃO DO ALFEU - CHANÃ - PRIMEIRO DISTRITO,CHANA - PRIM.DISTRITO,,
86355,ENCRUZILHADA DO SUL,19,1104,CENTRO COMUNITÁRIO SERRINHA DOS FONSECAS - ANTIGA ESCOLA SÃO PEDRO,SERRINHA DOS FONSECAS                  PRIM.DISTRITO,,
86355,ENCRUZILHADA DO SUL,19,1112,ESTAÇÃO EXPERIMENTAL - PRIMEIRO DISTRITO - ESCOLA HONÓRIO CARVALHO,ESTACAO EXPERIMENTAL                   PRIM. DISTRITO,,
86355,ENCRUZILHADA DO SUL,19,1120,SALÃO DA IGREJA - ALTO DAS FIGUEIRAS - PRIMEIRO DISTRITO,ALTO DAS FIGUEIRAS                     PRIM. DISTRITO,,
86355,ENCRUZILHADA DO SUL,19,1155,CENTRO COMUNITÁRIO DIVINO ESPIRITO SANTO - VAU DOS PRESTES- 2 DISTRITO,VAU DOS PRESTES-PROX.ZEFERINO PRESTES  SEG.DISTRITO,,
86355,ENCRUZILHADA DO SUL,19,1163,ASSOC. DA BANANEIRA (PEQ. AGRICULTORES)- RINCÃO DA FORMIGA- 1 DISTRITO,RINCAO DA FORMIGA - PRIM. DISTRITO,,
86355,ENCRUZILHADA DO SUL,19,1171,SEDE DO ASSENTAMENTO GUARA (MOTRIZA) - SERRA DOS NASCENTES,SERRA DOS NASCENTES,,
86355,ENCRUZILHADA DO SUL,19,1180,ESCOLA MUNICIPAL DOM JOAO VI - CORONEL PRESTES,CORONEL PRESTES - CINDO - ESTRADA ABRANJO,,
86355,ENCRUZILHADA DO SUL,19,1198,E. M. SELMA BECKER DA SILVEIRA - CORONEL PRESTES - SEGUNDO DISTRITO,CORONEL PRESTES                        SEG. DISTRITO,,
86355,ENCRUZILHADA DO SUL,19,1210,ESCOLA MUNICIPAL CASSIANO JOSE MORALLES - COXILHA DAS FIGUEIRAS,COXILHA DAS FIGUEIRAS,,
86355,ENCRUZILHADA DO SUL,19,1228,CENTRO COMUNITÁRIO PONTA DOS VARGAS - ANTIGA ESCOLA GONÇALVES LEDO,PONTA DOS VARGAS - PRÓXIMO DIAMARANTE NUNES,,
86355,ENCRUZILHADA DO SUL,19,1252,ASSOCIAÇÃO PONTA DOS VARGAS - PRÓX.AO AQUINO (ANTIGA JESUINO GUTERRES),PONTA DOS VARGAS - PRÓXIMO AO AQUINO,,
86355,ENCRUZILHADA DO SUL,19,1260,CENTRO COMUNTÁRIO RINCÃO DOS MACHADOS - ANTIGA ESCOLA VISCONDE DE MAUÁ,EM FRENTE À ANTIGA ESCOLA VISCONDE DE MAUÁ - RINCAO DOS MACHADOS,,
86355,ENCRUZILHADA DO SUL,19,1279,ESCOLA MUNICIPAL BIBIANO BATISTA - PINHEIRO - QUARTO DISTRITO,PINHEIRO                               QUARTO DISTRITO,,
86355,ENCRUZILHADA DO SUL,19,1287,SALÃO DO SR. RENILDO - CHAPADA - PROX. AO VALINHO - QUARTO DISTRITO,CHAPADA - PROXIMO AO VALINHO             QUARTO DISTRITO,,
86355,ENCRUZILHADA DO SUL,19,1295,ASSOCIAÇÃO DA PALMA - E.  NOSSA SENHORA DO CARMO - 4 DISTRITO,PALMAS QUARTO DISTRITO,,
